{
  "version": "1.0.0",
  "generated_at": "2026-04-10T11:29:33.251Z",
  "coverage_target": 0.9,
  "runtime_target_minutes": 5,
  "scenarios": [
    {
      "id": "E2E-BILLING-001",
      "story_id": "US-BILLING-001",
      "title": "Owner attaches payment method securely: Owner can create a setup intent",
      "module": "billing",
      "route": "/billing",
      "priority": "P0",
      "risk_score": 82,
      "critical_flow": true,
      "browser_matrix": [
        "chromium",
        "firefox",
        "webkit"
      ],
      "steps": [
        "Authenticate as company_owner",
        "Navigate to /billing",
        "Execute action: Owner can create a setup intent"
      ],
      "expected_outcome": "Owner can create a setup intent",
      "tags": [
        "billing",
        "critical",
        "payments"
      ]
    },
    {
      "id": "E2E-BILLING-002",
      "story_id": "US-BILLING-001",
      "title": "Owner attaches payment method securely: Owner can attach a card through Stripe Elements",
      "module": "billing",
      "route": "/billing",
      "priority": "P0",
      "risk_score": 82,
      "critical_flow": true,
      "browser_matrix": [
        "chromium",
        "firefox",
        "webkit"
      ],
      "steps": [
        "Authenticate as company_owner",
        "Navigate to /billing",
        "Execute action: Owner can attach a card through Stripe Elements"
      ],
      "expected_outcome": "Owner can attach a card through Stripe Elements",
      "tags": [
        "billing",
        "critical",
        "payments"
      ]
    },
    {
      "id": "E2E-BILLING-003",
      "story_id": "US-BILLING-001",
      "title": "Owner attaches payment method securely: Errors are shown for failed attachment",
      "module": "billing",
      "route": "/billing",
      "priority": "P0",
      "risk_score": 82,
      "critical_flow": true,
      "browser_matrix": [
        "chromium",
        "firefox",
        "webkit"
      ],
      "steps": [
        "Authenticate as company_owner",
        "Navigate to /billing",
        "Execute action: Errors are shown for failed attachment"
      ],
      "expected_outcome": "Errors are shown for failed attachment",
      "tags": [
        "billing",
        "critical",
        "payments"
      ]
    }
  ]
}
